href,quote,rating_num,titlehttps://movie.douban.com/subject/3592854/,,8.6,疯狂的麦克斯4：狂暴之路
https://movie.douban.com/subject/1867345/,用剩余不多的时间，去燃烧整个生命。,8.6,遗愿清单
https://movie.douban.com/subject/26787574/,,8.6,奇迹男孩
https://movie.douban.com/subject/1300960/,在那片深蓝中，感受来自大海的忧伤寂寞与美丽自由。,8.7,碧海蓝天
https://movie.douban.com/subject/1298653/,一个人的独角戏。,8.5,荒岛余生
https://movie.douban.com/subject/25921812/,过去的如果就让它过去了，未来只会越来越糟！,8.3,驴得水
https://movie.douban.com/subject/1300741/,一群演技精湛的戏骨，奉献出一个精致的黑帮小品，成就杜琪峰群戏的巅峰之作。,8.7,枪火
https://movie.douban.com/subject/1291853/,"In memory, love lives forever...",8.5,英国病人
https://movie.douban.com/subject/1905462/,出门必备：本草纲目。,8.6,荒野生存
